id	title	text	source	authors	url	created
12	The problem of shot selection in basketball	"In basketball, every time the offense produces a shot opportunity the player with the ball must decide whether the shot is worth taking. In this paper, I explore the question of when a team should shoot and when they should pass up the shot by considering a simple theoretical model of the shot selection process, in which the quality of shot opportunities generated by the offense is assumed to fall randomly within a uniform distribution. I derive an answer to the question ""how likely must the shot be to go in before the player should take it?"", and show that this ""lower cutoff"" for shot quality $f$ depends crucially on the number $n$ of shot opportunities remaining (say, before the shot clock expires), with larger $n$ demanding that only higher-quality shots should be taken. The function $f(n)$ is also derived in the presence of a finite turnover rate and used to predict the shooting rate of an optimal-shooting team as a function of time. This prediction is compared to observed shooting rates from the National Basketball Association (NBA), and the comparison suggests that NBA players tend to wait too long before shooting and undervalue the probability of committing a turnover."	generic	Brian Skinner	http://arxiv.org/abs/1107.5793v2	2011-07-28T19:01:58Z
13	Filtering Procedures for Sensor Data in Basketball	Big Data Analytics help team sports' managers in their decisions by processing a number of different kind of data. With the advent of Information Technologies, collecting, processing and storing big amounts of sport data in different form became possible. A problem that often arises when using sport data regards the need for automatic data cleaning procedures. In this paper we develop a data cleaning procedure for basketball which is based on players' trajectories. Starting from a data matrix that tracks the movements of the players on the court at different moments in the game, we propose an algorithm to automatically drop inactive moments making use of available sensor data. The algorithm also divides the game into sorted actions and labels them as offensive or defensive. The algorithm's parameters are validated using proper robustness checks.	generic	Rodolfo Metulini	http://arxiv.org/abs/1806.10412v1	2018-06-27T11:20:31Z
14	Application of Monte Carlo Simulations to Improve Basketball Shooting Strategy	The underlying physics of basketball shooting seems to be a straightforward example of the Newtonian mechanics that can easily be traced by numerical methods. However, a human basketball player does not make use of all the possible basketball trajectories. Instead, a basketball player will build up a database of successful shots and select the trajectory that has the greatest tolerance to small variations of the real world. We simulate the basketball player's shooting training as a Monte Carlo sequence to build optimal shooting strategies, such as the launch speed and angle of the basketball, and whether to take a direct shot or a bank shot, as a function of the player's court positions and height. The phase space volume that belongs to the successful launch velocities generated by Monte Carlo simulations are then used as the criterion to optimize a shooting strategy that incorporates not only mechanical, but human factors as well.	generic	Byeong June Min	http://arxiv.org/abs/1606.08145v2	2016-06-27T07:28:34Z
15	Descriptive and Predictive Analysis of Euroleague Basketball Games and the Wisdom of Basketball Crowds	"In this study we focus on the prediction of basketball games in the Euroleague competition using machine learning modelling. The prediction is a binary classification problem, predicting whether a match finishes 1 (home win) or 2 (away win). Data is collected from the Euroleague's official website for the seasons 2016-2017, 2017-2018 and 2018-2019, i.e. in the new format era. Features are extracted from matches' data and off-the-shelf supervised machine learning techniques are applied. We calibrate and validate our models. We find that simple machine learning models give accuracy not greater than 67% on the test set, worse than some sophisticated benchmark models. Additionally, the importance of this study lies in the ""wisdom of the basketball crowd"" and we demonstrate how the predicting power of a collective group of basketball enthusiasts can outperform machine learning models discussed in this study. We argue why the accuracy level of this group of ""experts"" should be set as the benchmark for future studies in the prediction of (European) basketball games using machine learning."	generic	Georgios Giasemidis	http://arxiv.org/abs/2002.08465v1	2020-02-19T22:04:29Z
16	Improving Algorithms for Fantasy Basketball	"Fantasy basketball has a rich underlying mathematical structure which makes optimal drafting strategy unclear. A central issue for category leagues is how to aggregate a player's statistics from all categories into a single number representing general value. It is shown that under a simplified model of fantasy basketball, a novel metric dubbed the ""G-score"" is appropriate for this purpose. The traditional metric used by analysts, ""Z-score"", is a special case of the G-score under the condition that future player performances are known exactly. The distinction between Z-score and G-score is particularly meaningful for head-to-head formats, because there is a large degree of uncertainty in player performance from one week to another. Simulated fantasy basketball seasons with head-to-head scoring provide evidence that G-scores do in fact outperform Z-scores in that context."	generic	Zach Rosenof	http://arxiv.org/abs/2307.02188v5	2023-07-05T10:27:46Z
17	The price of anarchy in basketball	"Optimizing the performance of a basketball offense may be viewed as a network problem, wherein each play represents a ""pathway"" through which the ball and players may move from origin (the in-bounds pass) to goal (the basket). Effective field goal percentages from the resulting shot attempts can be used to characterize the efficiency of each pathway. Inspired by recent discussions of the ""price of anarchy"" in traffic networks, this paper makes a formal analogy between a basketball offense and a simplified traffic network. The analysis suggests that there may be a significant difference between taking the highest-percentage shot each time down the court and playing the most efficient possible game. There may also be an analogue of Braess's Paradox in basketball, such that removing a key player from a team can result in the improvement of the team's offensive efficiency."	generic	Brian Skinner	http://arxiv.org/abs/0908.1801v4	2009-08-12T21:37:23Z
18	A Continuous-time Stochastic Block Model for Basketball Networks	For professional basketball, finding valuable and suitable players is the key to building a winning team. To deal with such challenges, basketball managers, scouts and coaches are increasingly turning to analytics. Objective evaluation of players and teams has always been the top goal of basketball analytics. Typical statistical analytics mainly focuses on the box score and has developed various metrics. In spite of the more and more advanced methods, metrics built upon box score statistics provide limited information about how players interact with each other. Two players with similar box scores may deliver distinct team plays. Thus professional basketball scouts have to watch real games to evaluate players. Live scouting is effective, but suffers from inefficiency and subjectivity. In this paper, we go beyond the static box score and model basketball games as dynamic networks. The proposed Continuous-time Stochastic Block Model clusters the players according to their playing style and performance. The model provides cluster-specific estimates of the effectiveness of players at scoring, rebounding, stealing, etc, and also captures player interaction patterns within and between clusters. By clustering similar players together, the model can help basketball scouts to narrow down the search space. Moreover, the model is able to reveal the subtle differences in the offensive strategies of different teams. An application to NBA basketball games illustrates the performance of the model.	generic	Lu Xin|Mu Zhu|Hugh Chipman	http://arxiv.org/abs/1507.01816v2	2015-07-04T20:14:45Z
19	Am I a Baller? Basketball Performance Assessment from First-Person Videos	This paper presents a method to assess a basketball player's performance from his/her first-person video. A key challenge lies in the fact that the evaluation metric is highly subjective and specific to a particular evaluator. We leverage the first-person camera to address this challenge. The spatiotemporal visual semantics provided by a first-person view allows us to reason about the camera wearer's actions while he/she is participating in an unscripted basketball game. Our method takes a player's first-person video and provides a player's performance measure that is specific to an evaluator's preference.   To achieve this goal, we first use a convolutional LSTM network to detect atomic basketball events from first-person videos. Our network's ability to zoom-in to the salient regions addresses the issue of a severe camera wearer's head movement in first-person videos. The detected atomic events are then passed through the Gaussian mixtures to construct a highly non-linear visual spatiotemporal basketball assessment feature. Finally, we use this feature to learn a basketball assessment model from pairs of labeled first-person basketball videos, for which a basketball expert indicates, which of the two players is better.   We demonstrate that despite not knowing the basketball evaluator's criterion, our model learns to accurately assess the players in real-world games. Furthermore, our model can also discover basketball events that contribute positively and negatively to a player's performance.	generic	Gedas Bertasius|Hyun Soo Park|Stella X. Yu|Jianbo Shi	http://arxiv.org/abs/1611.05365v4	2016-11-16T17:01:27Z
20	Basketball-SORT: An Association Method for Complex Multi-object Occlusion Problems in Basketball Multi-object Tracking	Recent deep learning-based object detection approaches have led to significant progress in multi-object tracking (MOT) algorithms. The current MOT methods mainly focus on pedestrian or vehicle scenes, but basketball sports scenes are usually accompanied by three or more object occlusion problems with similar appearances and high-intensity complex motions, which we call complex multi-object occlusion (CMOO). Here, we propose an online and robust MOT approach, named Basketball-SORT, which focuses on the CMOO problems in basketball videos. To overcome the CMOO problem, instead of using the intersection-over-union-based (IoU-based) approach, we use the trajectories of neighboring frames based on the projected positions of the players. Our method designs the basketball game restriction (BGR) and reacquiring Long-Lost IDs (RLLI) based on the characteristics of basketball scenes, and we also solve the occlusion problem based on the player trajectories and appearance features. Experimental results show that our method achieves a Higher Order Tracking Accuracy (HOTA) score of 63.48$\%$ on the basketball fixed video dataset and outperforms other recent popular approaches. Overall, our approach solved the CMOO problem more effectively than recent MOT algorithms.	generic	Qingrui Hu|Atom Scott|Calvin Yeung|Keisuke Fujii	http://arxiv.org/abs/2406.19655v1	2024-06-28T04:49:57Z
>>>>>>> Stashed changes
