id	title	text	source	authors	url	created
<<<<<<< Updated upstream
1		We are not doctors, we are not physio therapists.  Don't take your medical advice from Random People on the Internet.   We don't know why your knee hurts, or how to rehab a wrist sprain, or some other injury..... Go get it looked and get your advice from a professional.		Commandant1		
2		This thread for all questions on what shoes should i buy? What ball should i buy? Which hoop is best? How do I build an outdoor court? What knee brace is best? and all other clothing or gear or equipment questions.  Link to old thread. .  https://www.reddit.com/r/Basketball/comments/1f2wl91/official_basketball_shoes_and_gear_thread/		Commandant1		
3		Sometimes the defender can anticipate my moves and the position of the ball, reaching in quickly to steal it. It’s hard for me to protect the ball in those situations.		James_Dualsense		
4		Who got better mid range derozan or Shaun Livingston ? 		Old-Association-8727		
5		For reference, I'm an avid watcher of women's sports (tennis and soccer) and generally believe these sports don't get the attention they deserve. My twitter algorithm (which is messed up and very not customised) would show me lots of videos of Caitlin Clark and Sabrina Ionescu, which led me to believe the WNBA was actually doing quite well. I've also been to a couple of women's college games, and I thought they were doing well lol, but I guess I wouldn't know any better.   Today, a colleague mentioned that the quality of the WNBA in general is quite poor, and that    (1) Lots of basic mistakes e.g. layups are fumbled quite often   (2) The WNBA has not been selling as a product, and demand for tickets is low. My colleague mentioned that the NBA and NBA players contribute a decent amount of money to the WNBA to keep it afloat.    (3) Caitlin Clark would likely not stick around in the WNBA for much longer.   So I have a couple of questions   (1) Is the quality of the WNBA actually subpar?   (2) Are there other more popular women's basketball leagues, and are they more popular because the quality is better?   (3) Is the WNBA actually struggling to stay afloat financially, and is that because of the quality of matches?  Thanks everyone, and sorry if I did this wrong. It's my first time posting here		zapskaeshur		
6		I want to become a slasher, but i cant find a practice routine to follow. Its also hard to practice slashing solo because there is no defense. If someone can give me a couple drills to do or just a direction to go, that would be very appreciated.		LiveAwesome615		
7		I have varsity tryouts coming up this week but the coach has already told all the players that will be on the team this year who made it without seeing everyone play. I know I’m better than a decent amount of players on the team but it sucks that I don’t even have a chance to make the team		Live_Region_8232		
8		Only the Miami heats home court seems to have this. All other courts are currently very plain and clean looking. Why was the reasoning for the removal ?		handlerofdrones		
9		In my opinion there shouldn’t even be a debate, Jordan is by far the best of all time. It’s not close. Eye test, actual stats and analytics. He wins them all.   He beats LeBron in every single analytic in both the regular season and playoffs. VORP per 82, BPM, WS/48, Raptor, PER, OWS, DWS….oh and he has more championships, MVP’s, Finals MVP’s, scoring titles, all defensive first terms, etc.   I can’t believe people actually try debating this. 		Pat_Mahomes_Fan		
10		  [View Poll](https://www.reddit.com/poll/1oovnse)		Dontbeanasshole94		
11		We present iBall, a basketball video-watching system that leverages gaze-moderated embedded visualizations to facilitate game understanding and engagement of casual fans. Video broadcasting and online video platforms make watching basketball games increasingly accessible. Yet, for new or casual fans, watching basketball videos is often confusing due to their limited basketball knowledge and the lack of accessible, on-demand information to resolve their confusion. To assist casual fans in watching basketball videos, we compared the game-watching behaviors of casual and die-hard fans in a formative study and developed iBall based on the fndings. iBall embeds visualizations into basketball videos using a computer vision pipeline, and automatically adapts the visualizations based on the game context and users' gaze, helping casual fans appreciate basketball games without being overwhelmed. We confrmed the usefulness, usability, and engagement of iBall in a study with 16 casual fans, and further collected feedback from 8 die-hard fans.		Chen Zhu-Tian|Qisen Yang|Jiarui Shan|Tica Lin|Johanna Beyer|Haijun Xia|Hanspeter Pfister		
12		This paper presents a method to assess a basketball player's performance from his/her first-person video. A key challenge lies in the fact that the evaluation metric is highly subjective and specific to a particular evaluator. We leverage the first-person camera to address this challenge. The spatiotemporal visual semantics provided by a first-person view allows us to reason about the camera wearer's actions while he/she is participating in an unscripted basketball game. Our method takes a player's first-person video and provides a player's performance measure that is specific to an evaluator's preference.   To achieve this goal, we first use a convolutional LSTM network to detect atomic basketball events from first-person videos. Our network's ability to zoom-in to the salient regions addresses the issue of a severe camera wearer's head movement in first-person videos. The detected atomic events are then passed through the Gaussian mixtures to construct a highly non-linear visual spatiotemporal basketball assessment feature. Finally, we use this feature to learn a basketball assessment model from pairs of labeled first-person basketball videos, for which a basketball expert indicates, which of the two players is better.   We demonstrate that despite not knowing the basketball evaluator's criterion, our model learns to accurately assess the players in real-world games. Furthermore, our model can also discover basketball events that contribute positively and negatively to a player's performance.		Gedas Bertasius|Hyun Soo Park|Stella X. Yu|Jianbo Shi		
13		The underlying physics of basketball shooting seems to be a straightforward example of the Newtonian mechanics that can easily be traced by numerical methods. However, a human basketball player does not make use of all the possible basketball trajectories. Instead, a basketball player will build up a database of successful shots and select the trajectory that has the greatest tolerance to small variations of the real world. We simulate the basketball player's shooting training as a Monte Carlo sequence to build optimal shooting strategies, such as the launch speed and angle of the basketball, and whether to take a direct shot or a bank shot, as a function of the player's court positions and height. The phase space volume that belongs to the successful launch velocities generated by Monte Carlo simulations are then used as the criterion to optimize a shooting strategy that incorporates not only mechanical, but human factors as well.		Byeong June Min		
14		Recent deep learning-based object detection approaches have led to significant progress in multi-object tracking (MOT) algorithms. The current MOT methods mainly focus on pedestrian or vehicle scenes, but basketball sports scenes are usually accompanied by three or more object occlusion problems with similar appearances and high-intensity complex motions, which we call complex multi-object occlusion (CMOO). Here, we propose an online and robust MOT approach, named Basketball-SORT, which focuses on the CMOO problems in basketball videos. To overcome the CMOO problem, instead of using the intersection-over-union-based (IoU-based) approach, we use the trajectories of neighboring frames based on the projected positions of the players. Our method designs the basketball game restriction (BGR) and reacquiring Long-Lost IDs (RLLI) based on the characteristics of basketball scenes, and we also solve the occlusion problem based on the player trajectories and appearance features. Experimental results show that our method achieves a Higher Order Tracking Accuracy (HOTA) score of 63.48$\%$ on the basketball fixed video dataset and outperforms other recent popular approaches. Overall, our approach solved the CMOO problem more effectively than recent MOT algorithms.		Qingrui Hu|Atom Scott|Calvin Yeung|Keisuke Fujii		
15		This paper proposes a gravity balanced arm exoskeleton design for basketball shooting training. The potential energy equation of the mechanism is derived. A simulation of the arm going through the basketball shooting motion is done on the mechanism. Throughout the motion the total potential energy is constant. Thus, the proposed arm exoskeleton is indeed gravity balanced with the use of two springs.		Yunfei Liu|Zhanghao Yang		
16		For professional basketball, finding valuable and suitable players is the key to building a winning team. To deal with such challenges, basketball managers, scouts and coaches are increasingly turning to analytics. Objective evaluation of players and teams has always been the top goal of basketball analytics. Typical statistical analytics mainly focuses on the box score and has developed various metrics. In spite of the more and more advanced methods, metrics built upon box score statistics provide limited information about how players interact with each other. Two players with similar box scores may deliver distinct team plays. Thus professional basketball scouts have to watch real games to evaluate players. Live scouting is effective, but suffers from inefficiency and subjectivity. In this paper, we go beyond the static box score and model basketball games as dynamic networks. The proposed Continuous-time Stochastic Block Model clusters the players according to their playing style and performance. The model provides cluster-specific estimates of the effectiveness of players at scoring, rebounding, stealing, etc, and also captures player interaction patterns within and between clusters. By clustering similar players together, the model can help basketball scouts to narrow down the search space. Moreover, the model is able to reveal the subtle differences in the offensive strategies of different teams. An application to NBA basketball games illustrates the performance of the model.		Lu Xin|Mu Zhu|Hugh Chipman		
17		"In this study we focus on the prediction of basketball games in the Euroleague competition using machine learning modelling. The prediction is a binary classification problem, predicting whether a match finishes 1 (home win) or 2 (away win). Data is collected from the Euroleague's official website for the seasons 2016-2017, 2017-2018 and 2018-2019, i.e. in the new format era. Features are extracted from matches' data and off-the-shelf supervised machine learning techniques are applied. We calibrate and validate our models. We find that simple machine learning models give accuracy not greater than 67% on the test set, worse than some sophisticated benchmark models. Additionally, the importance of this study lies in the ""wisdom of the basketball crowd"" and we demonstrate how the predicting power of a collective group of basketball enthusiasts can outperform machine learning models discussed in this study. We argue why the accuracy level of this group of ""experts"" should be set as the benchmark for future studies in the prediction of (European) basketball games using machine learning."		Georgios Giasemidis		
18		The development of deep reinforcement learning (DRL) has benefited from the emergency of a variety type of game environments where new challenging problems are proposed and new algorithms can be tested safely and quickly, such as Board games, RTS, FPS, and MOBA games. However, many existing environments lack complexity and flexibility and assume the actions are synchronously executed in multi-agent settings, which become less valuable. We introduce the Fever Basketball game, a novel reinforcement learning environment where agents are trained to play basketball game. It is a complex and challenging environment that supports multiple characters, multiple positions, and both the single-agent and multi-agent player control modes. In addition, to better simulate real-world basketball games, the execution time of actions differs among players, which makes Fever Basketball a novel asynchronized environment. We evaluate commonly used multi-agent algorithms of both independent learners and joint-action learners in three game scenarios with varying difficulties, and heuristically propose two baseline methods to diminish the extra non-stationarity brought by asynchronism in Fever Basketball Benchmarks. Besides, we propose an integrated curricula training (ICT) framework to better handle Fever Basketball problems, which includes several game-rule based cascading curricula learners and a coordination curricula switcher focusing on enhancing coordination within the team. The results show that the game remains challenging and can be used as a benchmark environment for studies like long-time horizon, sparse rewards, credit assignment, and non-stationarity, etc. in multi-agent settings.		Hangtian Jia|Yujing Hu|Yingfeng Chen|Chunxu Ren|Tangjie Lv|Changjie Fan|Chongjie Zhang		
19		We present a model that uses a single first-person image to generate an egocentric basketball motion sequence in the form of a 12D camera configuration trajectory, which encodes a player's 3D location and 3D head orientation throughout the sequence. To do this, we first introduce a future convolutional neural network (CNN) that predicts an initial sequence of 12D camera configurations, aiming to capture how real players move during a one-on-one basketball game. We also introduce a goal verifier network, which is trained to verify that a given camera configuration is consistent with the final goals of real one-on-one basketball players. Next, we propose an inverse synthesis procedure to synthesize a refined sequence of 12D camera configurations that (1) sufficiently matches the initial configurations predicted by the future CNN, while (2) maximizing the output of the goal verifier network. Finally, by following the trajectory resulting from the refined camera configuration sequence, we obtain the complete 12D motion sequence.   Our model generates realistic basketball motion sequences that capture the goals of real players, outperforming standard deep learning approaches such as recurrent neural networks (RNNs), long short-term memory networks (LSTMs), and generative adversarial networks (GANs).		Gedas Bertasius|Aaron Chan|Jianbo Shi		
20		In professional basketball, the accurate prediction of scoring opportunities based on strategic decision-making is crucial for spatial and player evaluations. However, traditional models often face challenges in accounting for the complexities of off-ball movements, which are essential for comprehensive performance evaluations. In this study, we propose two mathematical models to predict off-ball scoring opportunities in basketball, considering pass-to-score and dribble-to-score sequences: the Ball Movement for Off-ball Scoring (BMOS) and the Ball Intercept and Movement for Off-ball Scoring (BIMOS) models. The BMOS model adapts principles from the Off-Ball Scoring Opportunities (OBSO) model, originally designed for soccer, to basketball, whereas the BIMOS model also incorporates the likelihood of interception during ball movements. We evaluated these models using player tracking data from 630 NBA games in the 2015-2016 regular season, demonstrating that the BIMOS model outperforms the BMOS model in terms of team scoring prediction accuracy, while also highlighting its potential for further development. Overall, the BIMOS model provides valuable insights for tactical analysis and player evaluation in basketball.		Rikako Kono|Keisuke Fujii		
=======
1	New Rule: Do Not ask for Medical Advice	We are not doctors, we are not physio therapists.  Don't take your medical advice from Random People on the Internet.   We don't know why your knee hurts, or how to rehab a wrist sprain, or some other injury..... Go get it looked and get your advice from a professional.	generic	Commandant1	https://www.reddit.com/r/Basketball/comments/1jo7aau/new_rule_do_not_ask_for_medical_advice/	1743438373.0
2	Official Shoes, Gear, Equipment, etc... Megathread	This thread for all questions on what shoes should i buy? What ball should i buy? Which hoop is best? How do I build an outdoor court? What knee brace is best? and all other clothing or gear or equipment questions.  Link to old thread. .  https://www.reddit.com/r/Basketball/comments/1f2wl91/official_basketball_shoes_and_gear_thread/	generic	Commandant1	https://www.reddit.com/r/Basketball/comments/1k1izx2/official_shoes_gear_equipment_etc_megathread/	1744912044.0
3	Michael Porter Jr. says he wants people to stop comparing WNBA players to men and claims he would’ve dominated the WNBA as an eighth grader	“I'm probably going with 8th grade because I have real experience doing this. I played my sisters. They played at The University of Missouri and I was still a young kid. They had me playing on the scout team and they had a few WNBA players on their team like, Sophie Cunningham and a couple others. I was in the 7th or 8th grade going crazy. So, I have real life experience. It's just a difference and I wish this would stop being a conversation because it should be common sense. I appreciate common sense. I feel sometimes that's lost a little bit.”  Via Ball in the family podcast with Lonzo & Gelo Ball  I do think NBA players in 8th grade like MPJ who was always a top ranked prospect all his grade school days would still be able to compete especially since he always had the size on him too. Maybe inexperience would have gotten him but I don't think he would have gotten absolutely cooked.	generic	Eastern_Courage_7080	https://www.reddit.com/r/Basketball/comments/1p1lnlg/michael_porter_jr_says_he_wants_people_to_stop/	1763590492.0
4	Dear coaches, do you use stat trackers ? which one ?		generic	FantasticCockroach30	/r/basketballcoach/comments/1p227h5/do_you_use_stat_trackers_wich_one/	1763642724.0
5	Should i cut this player off?	Me and some guys usually book one private run a week as some of us dont like going to a local gym but still enjoy hooping.      one of the guys that comes on the other team had basically missed every shot the entire session, and had a run where he smoked like 3 wide open layups all back to back. he picked up the chair, and threw it where our bags where. He also often will throw his teammates under the bus, telling them to lock in despite him not contributing much. He doesn't cut, he doesn't set screens often, and he often gives up 3s because he doesn't step up on screens.   and after his behavior , i just kind of view him differently. Im the one that organizes the run and sends the invite for the session and hes usually a regular but he has a poor attitude and him bursting out like that was not the first time. the previous time he smashed the cushion on the wall out of anger.     we try to coach him up a bit and tell him that if he did other things on the court him missing his shots isnt as detrimental because hes at least a positive in other ways.      i feel bad because ive known him since highschool and although we arent friends off the court hes a decent guy. 	generic	Open_Bake_8013	https://www.reddit.com/r/Basketball/comments/1p1o33b/should_i_cut_this_player_off/	1763596577.0
6	How to stop getting blocked in the post up	I am relatively new to the sport, I am 6'3 which in my country and high-school gives me the opportunity to play the 1-5. Im wanting to learn how to properly post up.  I 1v1 my brother (who is the same height, weight, wingspan etc as me) but whenever I get in the post up with him he tends to block me. Is there any tips you guys can give so I can stop getting blocked in the paint so much?	generic	DueSinger8275	https://www.reddit.com/r/Basketball/comments/1p1yysh/how_to_stop_getting_blocked_in_the_post_up/	1763631419.0
7	As a new player, how long did it take you to feel ‘good’ at the game?	Im starting out playing, and while I do plan to be disciplined and not let me being trash now demotivate me im just seeing how long the grind to be good felt for u guys 	generic	RaynbowZFTW	https://www.reddit.com/r/Basketball/comments/1p19435/as_a_new_player_how_long_did_it_take_you_to_feel/	1763562495.0
8	Men’s league tournaments	Hi all - I’m in a men’s league that is full of decent talent. A lot of former college players. We have an interest in traveling somewhere within the US that has some sort of league tournaments that can be entered by anyone who wants to play.   We are a mix of guys in their 20s, 30s (mostly) and 40s. There are several dunks per night when we have runs, but no one is jumping out the gym or crazy with athleticism anymore mainly due to age.   We’d be looking for a similar mix, and not something toxic and no awful shit like you see on creator league or Friga runs.   Something with real organization and actual trained refs, where the toxic bullshit is checked at the door. Competitive spirit is fine.   We don’t care where in the US it is. We are all professionals and most of us have families. Think of this as a bunch of dudes who want to have a fun dad/basketball weekend, but we can also play some serious hoop and don’t want some basic YMCA bullshit with dudes who can barely dribble and can’t shoot.   Any suggestions?? 	generic	Mediocre_man11	https://www.reddit.com/r/Basketball/comments/1p1ha0n/mens_league_tournaments/	1763580591.0
9	Coaching advice (middleschool rec)	Hey folks -  I've always helped out coaching recreational basketball.  Girls, grades 5-8.  This year I have my own team and wanted to get some advice for you all.  Typically they always play man to man.  Personally I feel a zone is a much easier defense to teach (2-3/2-1-2) as man ends up being a disaster.     Offense I really need some help as some of these girls never played.  What are some go to plays I can teach them to get the ball moving around?  Thanks for any advice, looking to make this a fun year for the girls and reddit never disappoints.  Thanks in advance 	generic	davetheflashguy	https://www.reddit.com/r/Basketball/comments/1p197iq/coaching_advice_middleschool_rec/	1763562725.0
10	"6'9"" center needs power forward advice"	"I'm a 6'9"" junior in high school who just started playing last year. I've always been a center but I feel like I would make a better power forward because of how much I like to finish through contact and because I have a pretty good vert, as well as being really tall and 230lbs. Please just give me all the advice you can, keeping in mind I'm a pretty recent baller in a D1 high school."	generic	LeadInternational224	https://www.reddit.com/r/Basketball/comments/1p0sbfi/69_center_needs_power_forward_advice/	1763510447.0
11	Learning to Ball: Composing Policies for Long-Horizon Basketball Moves	Learning a control policy for a multi-phase, long-horizon task, such as basketball maneuvers, remains challenging for reinforcement learning approaches due to the need for seamless policy composition and transitions between skills. A long-horizon task typically consists of distinct subtasks with well-defined goals, separated by transitional subtasks with unclear goals but critical to the success of the entire task. Existing methods like the mixture of experts and skill chaining struggle with tasks where individual policies do not share significant commonly explored states or lack well-defined initial and terminal states between different phases. In this paper, we introduce a novel policy integration framework to enable the composition of drastically different motor skills in multi-phase long-horizon tasks with ill-defined intermediate states. Based on that, we further introduce a high-level soft router to enable seamless and robust transitions between the subtasks. We evaluate our framework on a set of fundamental basketball skills and challenging transitions. Policies trained by our approach can effectively control the simulated character to interact with the ball and accomplish the long-horizon task specified by real-time user commands, without relying on ball trajectory references.	generic	Pei Xu|Zhen Wu|Ruocheng Wang|Vishnu Sarukkai|Kayvon Fatahalian|Ioannis Karamouzas|Victor Zordan|C. Karen Liu	http://arxiv.org/abs/2509.22442v1	2025-09-26T15:02:05Z
